{
  "date": "2026-10-31",
  "timezone": "Asia/Kolkata",
  "generated_at": "2026-10-31T02:05:12.423Z",
  "summary": "Day 43 of 72 (Full Data Interpretation Marathon (4 Classic CAT DI Sets)): Solve 4 complete CAT DI sets under exam timing. Focus on smart rounding and eliminating unviable answer choices.",
  "urgent_alerts": [
    {
      "title": "CAT 2026 Admit Card Release",
      "deadline": "2026-11-05T23:59:59+05:30",
      "action": "Download CAT 2026 admit card on iimcat.ac.in (expected early Nov, verify on iimcat.ac.in). Note allocated slot (Slot 1, 2, or 3), and align mock tests with slot timing."
    }
  ],
  "blocks": [
    {
      "id": "block-dsa",
      "start": "07:30",
      "end": "08:15",
      "title": "DSA Algorithmic Problem Solving (2 Problems)",
      "stream": "dsa",
      "details": "Solve 2 curated LeetCode problems (1 Medium + 1 Easy/Review) from the 247-problem DSA Tracker. Focus on algorithmic clarity and edge cases.",
      "links": [
        "dsa_master_tracker.html"
      ],
      "priority": 1,
      "notify_before_min": 10,
      "verify": false
    },
    {
      "id": "block-job",
      "start": "08:15",
      "end": "09:00",
      "title": "Job Search Recruiter Triage & Screening Replies",
      "stream": "job",
      "details": "15–30 min recruiter communications triage: reply to inbound messages, confirm availability, schedule technical screenings, and follow up on pending submissions.",
      "links": [
        "profile.html#cold-email",
        "https://www.instahyre.com"
      ],
      "priority": 2,
      "notify_before_min": 10,
      "verify": false
    },
    {
      "id": "block-cat-qa-dilr",
      "start": "10:00",
      "end": "12:00",
      "title": "CAT Day 43: QA & DILR Focus",
      "stream": "cat",
      "details": "QA: 20 Questions on mixed Algebra (Logs, AP-GP, Quadratics) to consolidate Phase 2 skills.. DILR: Solve 4 DI sets from CAT 2022 Slot 2 & Slot 3 on 2IIM. Compare calculation methods with 2IIM videos..",
      "links": [
        "cat_2026_syllabus_roadmap.html",
        "cat_2026_syllabus_roadmap.html#day-43"
      ],
      "priority": 1,
      "notify_before_min": 10,
      "verify": false
    },
    {
      "id": "block-germany-admin",
      "start": "14:30",
      "end": "15:30",
      "title": "Germany Academic Admin & Prerequisite Audits",
      "stream": "germany",
      "details": "Zero-fee audit tasks: Check Anabin H+ status for MDU, audit dMAT status on aps-india.de/dmat, review Passau interactive guide checklist, and email MDU for 100% English MOI letter.",
      "links": [
        "deadlines_calendar.html#prerequisite-tasks",
        "https://anabin.kmk.org",
        "https://aps-india.de/dmat",
        "https://www.uni-passau.de/en/apply"
      ],
      "priority": 2,
      "notify_before_min": 10,
      "verify": true
    },
    {
      "id": "block-cat-varc",
      "start": "16:30",
      "end": "18:00",
      "title": "CAT Day 43: VARC & Verbal Ability",
      "stream": "cat",
      "details": "Take Full VARC Sectional Test 4 on Career Launcher MyZone (24 Qs, 40 Mins). Review trap answer selections. Maintain error log on Career Launcher MyZone.",
      "links": [
        "cat_2026_syllabus_roadmap.html",
        "cat_2026_syllabus_roadmap.html#day-43"
      ],
      "priority": 1,
      "notify_before_min": 10,
      "verify": false
    }
  ],
  "totals_by_stream_min": {
    "dsa": 45,
    "job": 45,
    "cat": 210,
    "germany": 60
  }
}