{
  "date": "2026-09-28",
  "timezone": "Asia/Kolkata",
  "generated_at": "2026-09-28T01:26:46.414Z",
  "summary": "Day 10 of 72 (Mixtures & Alligations: The Alligation Cross Rule): Master the alligation cross formula for weighted averages of solutions, milk-water dilutions, and replacement formulas.",
  "urgent_alerts": [
    {
      "title": "APS India Courier Document Dispatch",
      "deadline": "2026-10-02T23:59:59+05:30",
      "action": "Courier physical document packet (Semesters 1–8 marksheets, degree certificate, DigiLocker consent) to APS New Delhi."
    }
  ],
  "blocks": [
    {
      "id": "block-dsa",
      "start": "07:30",
      "end": "08:15",
      "title": "DSA Algorithmic Problem Solving (2 Problems)",
      "stream": "dsa",
      "details": "Solve 2 curated LeetCode problems (1 Medium + 1 Easy/Review) from the 247-problem DSA Tracker. Focus on algorithmic clarity and edge cases.",
      "links": [
        "dsa_master_tracker.html"
      ],
      "priority": 1,
      "notify_before_min": 10,
      "verify": false
    },
    {
      "id": "block-job",
      "start": "08:15",
      "end": "09:00",
      "title": "Dedicated Job Outreach Application Batch",
      "stream": "job",
      "details": "Dedicated morning batch: Submit 8–10 tailored applications on Instahyre and LinkedIn Jobs. Target Series A–C tech and European remote roles highlighting Immediate Joiner status.",
      "links": [
        "profile.html#cold-email",
        "https://www.instahyre.com"
      ],
      "priority": 2,
      "notify_before_min": 10,
      "verify": false
    },
    {
      "id": "block-cat-qa-dilr",
      "start": "10:00",
      "end": "12:00",
      "title": "CAT Day 10: QA & DILR Focus",
      "stream": "cat",
      "details": "QA: 25 Questions on Alligations & Repeated Dilution: Q = Q0(1 - x/V)^n formula mastery and dual-alloy melting ratios.. DILR: Circular Arrangements 1 (All facing center, 6 to 8 people). Solve 2 sets from Rodha DILR. Watch for relative left/right cues..",
      "links": [
        "cat_2026_syllabus_roadmap.html",
        "cat_2026_syllabus_roadmap.html#day-10"
      ],
      "priority": 1,
      "notify_before_min": 10,
      "verify": false
    },
    {
      "id": "block-germany-admin",
      "start": "14:30",
      "end": "15:30",
      "title": "Germany Academic Admin & Prerequisite Audits",
      "stream": "germany",
      "details": "Zero-fee audit tasks: Check Anabin H+ status for MDU, audit dMAT status on aps-india.de/dmat, review Passau interactive guide checklist, and email MDU for 100% English MOI letter.",
      "links": [
        "deadlines_calendar.html#prerequisite-tasks",
        "https://anabin.kmk.org",
        "https://aps-india.de/dmat",
        "https://www.uni-passau.de/en/apply"
      ],
      "priority": 2,
      "notify_before_min": 10,
      "verify": true
    },
    {
      "id": "block-cat-varc",
      "start": "16:30",
      "end": "18:00",
      "title": "CAT Day 10: VARC & Verbal Ability",
      "stream": "cat",
      "details": "CL MyZone VARC: RC Module 2 - Fact-based vs Inference-based questions. Solve 2 passages (8 Qs) in 18 mins. Maintain error log on Career Launcher MyZone.",
      "links": [
        "cat_2026_syllabus_roadmap.html",
        "cat_2026_syllabus_roadmap.html#day-10"
      ],
      "priority": 1,
      "notify_before_min": 10,
      "verify": false
    }
  ],
  "totals_by_stream_min": {
    "dsa": 45,
    "job": 45,
    "cat": 210,
    "germany": 60
  }
}