{
  "date": "2026-10-25",
  "timezone": "Asia/Kolkata",
  "generated_at": "2026-10-25T00:53:35.086Z",
  "summary": "Day 37 of 72 (Mid-Way Milestone: Full 2-Hour Benchmark Mock 2): Take full 120-minute national benchmark mock. Test combined Arithmetic + Algebra question harvesting.",
  "urgent_alerts": [],
  "blocks": [
    {
      "id": "block-dsa",
      "start": "07:30",
      "end": "08:15",
      "title": "DSA Algorithmic Problem Solving (2 Problems)",
      "stream": "dsa",
      "details": "Solve 2 curated LeetCode problems (1 Medium + 1 Easy/Review) from the 247-problem DSA Tracker. Focus on algorithmic clarity and edge cases.",
      "links": [
        "dsa_master_tracker.html"
      ],
      "priority": 1,
      "notify_before_min": 10,
      "verify": false
    },
    {
      "id": "block-job",
      "start": "08:15",
      "end": "09:00",
      "title": "Job Search Recruiter Triage & Screening Replies",
      "stream": "job",
      "details": "15–30 min recruiter communications triage: reply to inbound messages, confirm availability, schedule technical screenings, and follow up on pending submissions.",
      "links": [
        "profile.html#cold-email",
        "https://www.instahyre.com"
      ],
      "priority": 2,
      "notify_before_min": 10,
      "verify": false
    },
    {
      "id": "block-cat-qa-dilr",
      "start": "10:00",
      "end": "12:00",
      "title": "CAT Day 37: QA & DILR Focus",
      "stream": "cat",
      "details": "QA: Benchmark Mock 2 - Section 3: QA 40 mins. Scan entire section in 3 mins. Harvest 10–12 Arithmetic/Algebra Qs.. DILR: Benchmark Mock 2 - Section 2: DILR 40 mins. Rapid 5-min scan. Attempt best 2 sets (8–10 Qs)..",
      "links": [
        "cat_2026_syllabus_roadmap.html",
        "cat_2026_syllabus_roadmap.html#day-37"
      ],
      "priority": 1,
      "notify_before_min": 10,
      "verify": false
    },
    {
      "id": "block-germany-admin",
      "start": "14:30",
      "end": "15:30",
      "title": "Germany Academic Admin & Prerequisite Audits",
      "stream": "germany",
      "details": "Zero-fee audit tasks: Check Anabin H+ status for MDU, audit dMAT status on aps-india.de/dmat, review Passau interactive guide checklist, and email MDU for 100% English MOI letter.",
      "links": [
        "deadlines_calendar.html#prerequisite-tasks",
        "https://anabin.kmk.org",
        "https://aps-india.de/dmat",
        "https://www.uni-passau.de/en/apply"
      ],
      "priority": 2,
      "notify_before_min": 10,
      "verify": true
    },
    {
      "id": "block-cat-varc",
      "start": "16:30",
      "end": "18:00",
      "title": "CAT Day 37: VARC & Verbal Ability",
      "stream": "cat",
      "details": "Benchmark Mock 2 - Section 1: VARC 40 mins. Attempt 3 RCs (12 Qs) + 5 VA Qs. Target: 30+ marks. Maintain error log on Career Launcher MyZone.",
      "links": [
        "cat_2026_syllabus_roadmap.html",
        "cat_2026_syllabus_roadmap.html#day-37"
      ],
      "priority": 1,
      "notify_before_min": 10,
      "verify": false
    }
  ],
  "totals_by_stream_min": {
    "dsa": 45,
    "job": 45,
    "cat": 210,
    "germany": 60
  }
}