{
  "date": "2026-09-24",
  "timezone": "Asia/Kolkata",
  "generated_at": "2026-09-24T01:11:22.712Z",
  "summary": "Day 6 of 72 (Simple Interest, Compound Interest & Depreciation): Lock down multi-period compounding (annual vs half-yearly) and CI-SI difference relations.",
  "urgent_alerts": [],
  "blocks": [
    {
      "id": "block-dsa",
      "start": "07:30",
      "end": "08:15",
      "title": "DSA Algorithmic Problem Solving (2 Problems)",
      "stream": "dsa",
      "details": "Solve 2 curated LeetCode problems (1 Medium + 1 Easy/Review) from the 247-problem DSA Tracker. Focus on algorithmic clarity and edge cases.",
      "links": [
        "dsa_master_tracker.html"
      ],
      "priority": 1,
      "notify_before_min": 10,
      "verify": false
    },
    {
      "id": "block-job",
      "start": "08:15",
      "end": "09:00",
      "title": "Job Search Recruiter Triage & Screening Replies",
      "stream": "job",
      "details": "15–30 min recruiter communications triage: reply to inbound messages, confirm availability, schedule technical screenings, and follow up on pending submissions.",
      "links": [
        "profile.html#cold-email",
        "https://www.instahyre.com"
      ],
      "priority": 2,
      "notify_before_min": 10,
      "verify": false
    },
    {
      "id": "block-cat-qa-dilr",
      "start": "10:00",
      "end": "12:00",
      "title": "CAT Day 6: QA & DILR Focus",
      "stream": "cat",
      "details": "QA: 20 Questions on CI installments and multi-year rate changes. Verify formulas using Cracku QA Formula Cheat Sheet.. DILR: Matrix Grid with 3 Variables (e.g. Person, City, Profession). Solve Anastasis Shankar Set 4. Master cross-elimination tick/cross tables..",
      "links": [
        "cat_2026_syllabus_roadmap.html",
        "cat_2026_syllabus_roadmap.html#day-6"
      ],
      "priority": 1,
      "notify_before_min": 10,
      "verify": false
    },
    {
      "id": "block-germany-admin",
      "start": "14:30",
      "end": "15:30",
      "title": "Germany Academic Admin & Prerequisite Audits",
      "stream": "germany",
      "details": "Zero-fee audit tasks: Check Anabin H+ status for MDU, audit dMAT status on aps-india.de/dmat, review Passau interactive guide checklist, and email MDU for 100% English MOI letter.",
      "links": [
        "deadlines_calendar.html#prerequisite-tasks",
        "https://anabin.kmk.org",
        "https://aps-india.de/dmat",
        "https://www.uni-passau.de/en/apply"
      ],
      "priority": 2,
      "notify_before_min": 10,
      "verify": true
    },
    {
      "id": "block-cat-varc",
      "start": "16:30",
      "end": "18:00",
      "title": "CAT Day 6: VARC & Verbal Ability",
      "stream": "cat",
      "details": "Read 1 long-form Guardian essay. Solve Cracku Free Daily Verbal Target (1 RC passage drill + argument structure analysis). Maintain error log on Career Launcher MyZone.",
      "links": [
        "cat_2026_syllabus_roadmap.html",
        "cat_2026_syllabus_roadmap.html#day-6"
      ],
      "priority": 1,
      "notify_before_min": 10,
      "verify": false
    }
  ],
  "totals_by_stream_min": {
    "dsa": 45,
    "job": 45,
    "cat": 210,
    "germany": 60
  }
}