{
  "date": "2026-10-02",
  "timezone": "Asia/Kolkata",
  "generated_at": "2026-10-02T02:02:51.384Z",
  "summary": "Day 14 of 72 (TSD 3: Boats & Streams + Circular Tracks): Master upstream (u - v) and downstream (u + v) dynamics, and circular track meeting points (first time vs at starting point).",
  "urgent_alerts": [
    {
      "title": "APS India Courier Document Dispatch",
      "deadline": "2026-10-02T23:59:59+05:30",
      "action": "Courier physical document packet (Semesters 1–8 marksheets, degree certificate, DigiLocker consent) to APS New Delhi."
    }
  ],
  "blocks": [
    {
      "id": "block-dsa",
      "start": "07:30",
      "end": "08:15",
      "title": "DSA Algorithmic Problem Solving (2 Problems)",
      "stream": "dsa",
      "details": "Solve 2 curated LeetCode problems (1 Medium + 1 Easy/Review) from the 247-problem DSA Tracker. Focus on algorithmic clarity and edge cases.",
      "links": [
        "dsa_master_tracker.html"
      ],
      "priority": 1,
      "notify_before_min": 10,
      "verify": false
    },
    {
      "id": "block-job",
      "start": "08:15",
      "end": "09:00",
      "title": "Job Search Recruiter Triage & Screening Replies",
      "stream": "job",
      "details": "15–30 min recruiter communications triage: reply to inbound messages, confirm availability, schedule technical screenings, and follow up on pending submissions.",
      "links": [
        "profile.html#cold-email",
        "https://www.instahyre.com"
      ],
      "priority": 2,
      "notify_before_min": 10,
      "verify": false
    },
    {
      "id": "block-cat-qa-dilr",
      "start": "10:00",
      "end": "12:00",
      "title": "CAT Day 14: QA & DILR Focus",
      "stream": "cat",
      "details": "QA: 20 Questions on Boats & Streams + 15 Questions on Circular Tracks (L/(u-v) vs LCM of individual lap times).. DILR: Anastasis Shankar Set 9 & Set 10: Multi-stage selection games and condition-dependent seating grids..",
      "links": [
        "cat_2026_syllabus_roadmap.html",
        "cat_2026_syllabus_roadmap.html#day-14"
      ],
      "priority": 1,
      "notify_before_min": 10,
      "verify": false
    },
    {
      "id": "block-germany-admin",
      "start": "14:30",
      "end": "15:30",
      "title": "Germany Academic Admin & Prerequisite Audits",
      "stream": "germany",
      "details": "Zero-fee audit tasks: Check Anabin H+ status for MDU, audit dMAT status on aps-india.de/dmat, review Passau interactive guide checklist, and email MDU for 100% English MOI letter.",
      "links": [
        "deadlines_calendar.html#prerequisite-tasks",
        "https://anabin.kmk.org",
        "https://aps-india.de/dmat",
        "https://www.uni-passau.de/en/apply"
      ],
      "priority": 2,
      "notify_before_min": 10,
      "verify": true
    },
    {
      "id": "block-cat-varc",
      "start": "16:30",
      "end": "18:00",
      "title": "CAT Day 14: VARC & Verbal Ability",
      "stream": "cat",
      "details": "CL MyZone VARC: Odd Sentence Out (Out-of-Context Sentence) techniques. Solve 10 questions on MyZone portal. Maintain error log on Career Launcher MyZone.",
      "links": [
        "cat_2026_syllabus_roadmap.html",
        "cat_2026_syllabus_roadmap.html#day-14"
      ],
      "priority": 1,
      "notify_before_min": 10,
      "verify": false
    }
  ],
  "totals_by_stream_min": {
    "dsa": 45,
    "job": 45,
    "cat": 210,
    "germany": 60
  }
}