{
  "date": "2026-09-20",
  "timezone": "Asia/Kolkata",
  "generated_at": "2026-09-20T13:44:37.890Z",
  "summary": "Day 2 of 72 (Diagnostic Error Log Deep-Dive + Fraction-to-Percentage Chart): Complete a 3-hour forensic post-mortem of Day 1 Diagnostic. Classify every lost mark into Conceptual Gap, Misread Trap, or Time Exhaustion.",
  "urgent_alerts": [

    {
      "title": "dMAT Status Check (aps-india.de/dmat & g.a.s.t.)",
      "deadline": "2026-09-22T23:59:59+05:30",
      "action": "Check if dMAT registration is closed, exempt, or scheduled for next sitting; if closed, lock Winter 2027/28 branch."
    },
    {
      "title": "Anabin H+ Check for MDU Rohtak",
      "deadline": "2026-09-22T23:59:59+05:30",
      "action": "Verify MDU H+ institutional status and B.Tech CSE degree recognition on anabin.kmk.org; save PDF confirmation."
    },
    {
      "title": "Run Passau Interactive Guide",
      "deadline": "2026-09-22T23:59:59+05:30",
      "action": "Run Passau interactive application guide for M.Sc. CS/AI to confirm application route (direct portal vs uni-assist; no VPD)."
    },
    {
      "title": "Email MDU for MOI Letter & Cohort Ranking Doc",
      "deadline": "2026-09-22T23:59:59+05:30",
      "action": "Send email to MDU Rohtak Registrar requesting 100% English Medium-of-Instruction letter and official cohort ranking certificate."
    }
  ],
  "blocks": [
    {
      "id": "block-dsa",
      "start": "07:30",
      "end": "08:15",
      "title": "DSA Algorithmic Problem Solving (2 Problems)",
      "stream": "dsa",
      "details": "Solve 2 curated LeetCode problems (1 Medium + 1 Easy/Review) from the 247-problem DSA Tracker. Focus on algorithmic clarity and edge cases.",
      "links": [
        "dsa_master_tracker.html"
      ],
      "priority": 1,
      "notify_before_min": 10,
      "verify": false
    },
    {
      "id": "block-job",
      "start": "08:15",
      "end": "09:00",
      "title": "Job Search Recruiter Triage & Screening Replies",
      "stream": "job",
      "details": "15–30 min recruiter communications triage: reply to inbound messages, confirm availability, schedule technical screenings, and follow up on pending submissions.",
      "links": [
        "profile.html#cold-email",
        "https://www.instahyre.com"
      ],
      "priority": 2,
      "notify_before_min": 10,
      "verify": false
    },
    {
      "id": "block-cat-qa-dilr",
      "start": "10:00",
      "end": "12:00",
      "title": "CAT Day 2: QA & DILR Focus",
      "stream": "cat",
      "details": "QA: Solve 20 Percentage Change & Successive Percentage Change problems from Rodha Quant Playlist. Verify multiplier shortcuts.. DILR: Solve 1 Matrix Grid logic set from Anastasis DILR 200 Sets (Set 1). Write down the grid setup protocol in your DILR journal..",
      "links": [
        "cat_2026_syllabus_roadmap.html",
        "cat_2026_syllabus_roadmap.html#day-2"
      ],
      "priority": 1,
      "notify_before_min": 10,
      "verify": false
    },
    {
      "id": "block-germany-admin",
      "start": "14:30",
      "end": "15:30",
      "title": "Germany Academic Admin & Prerequisite Audits",
      "stream": "germany",
      "details": "Zero-fee audit tasks: Check Anabin H+ status for MDU, audit dMAT status on aps-india.de/dmat, review Passau interactive guide checklist, and email MDU for 100% English MOI letter.",
      "links": [
        "deadlines_calendar.html#prerequisite-tasks",
        "https://anabin.kmk.org",
        "https://aps-india.de/dmat",
        "https://www.uni-passau.de/en/apply"
      ],
      "priority": 2,
      "notify_before_min": 10,
      "verify": true
    },
    {
      "id": "block-cat-varc",
      "start": "16:30",
      "end": "18:00",
      "title": "CAT Day 2: VARC & Verbal Ability",
      "stream": "cat",
      "details": "Analyze Diagnostic VARC passages question-by-question. Check Gejo Speaks RC Mechanics Module 1 on CL MyZone. Maintain error log on Career Launcher MyZone.",
      "links": [
        "cat_2026_syllabus_roadmap.html",
        "cat_2026_syllabus_roadmap.html#day-2"
      ],
      "priority": 1,
      "notify_before_min": 10,
      "verify": false
    }
  ],
  "totals_by_stream_min": {
    "dsa": 45,
    "job": 45,
    "cat": 210,
    "germany": 60
  }
}